Unisound,"1,00,00,00,000",19-07-2018,2018,Artificial intelligence,Beijing,Beijing,China,Asia,2012,"36,10,00,000",Qiming Venture Partners, China Internet Investment Fund, Qualcomm Ventures,,
Betterment,"1,00,00,00,000",29-09-2021,2021,Fintech,New York,New York,United States,North America,2010,"33,50,00,000",Bessemer Venture Partners, Menlo Ventures, Anthermis,,
Cava Group,"1,00,00,00,000",27-04-2021,2021,Other,Washington,Washington,United States,North America,2010,"73,80,00,000",SWaN & Legend Ventures, Revolution Growth, Invus Group,,
CoinTracker,"1,00,00,00,000",27-01-2022,2022,Fintech,San Francisco,California,United States,North America,2017,"10,20,00,000",Initialized Capital, General Catalyst, Kraken Ventures,,
DistroKid,"1,00,00,00,000",16-08-2021,2021,Internet software & services,New York,New York,United States,North America,2013,0,Insight Partners, Silversmith Capital Partners, Spotify,,
Domestika,"1,00,00,00,000",27-01-2022,2022,Internet software & services,Berkeley,California,United States,North America,2012,"13,00,00,000",Zeev Ventures, GSV Ventures,,,
Flock Freight,"1,00,00,00,000",20-10-2021,2021,"Supply chain, logistics, & delivery",Encinitas,California,United States,North America,2015,"39,90,00,000",SignalFire, GLP Capital Partners, Google Ventures,,
InSightec,"1,00,00,00,000",6/3/2020,2020,Health,Tirat Carmel,Haifa District,Israel,Asia,1999,"63,30,00,000",York Capital Management, GE Healthcare, Koch Disruptive Technologies,,
Island,"1,00,00,00,000",23-03-2022,2022,Internet software & services,Dallas,Texas,United States,North America,2020,"21,50,00,000",Insight Partners, Sequoia Capital, Stripes Group,,
iTrustCapital,"1,00,00,00,000",11/1/2022,2022,Fintech,Long Beach,California,United States,North America,2018,"12,80,00,000",Left Lane Capital, Walden Venture Capital,,,
Konfio,"1,00,00,00,000",29-09-2021,2021,Fintech,Mexico City,Mexico City,Mexico,North America,2013,"37,80,00,000",Kaszek Ventures, QED Investors, International Finance Corporation,,
LinkTree,"1,00,00,00,000",16-03-2022,2022,Internet software & services,Melbourne,Victoria,Australia,Oceania,2016,"16,60,00,000",AirTree Ventures, Insight Partners, Index Ventures,,
Loadsmart,"1,00,00,00,000",1/2/2022,2022,"Supply chain, logistics, & delivery",New York,New York,United States,North America,2014,"33,60,00,000",Chromo Invest, Maersk Growth, BlackRock,,
Lukka,"1,00,00,00,000",14-01-2022,2022,Fintech,New York,New York,United States,North America,2014,"20,10,00,000",Liberty City Ventures, Soros Fund Management, Summer Capital,,
Manner,"1,00,00,00,000",24-12-2020,2020,Other,Shanghai,Shanghai,China,Asia,2015,"1,00,00,000",Coatue Management, H Capital, Capital Today,,
The Brandtech Group,"1,00,00,00,000",19-11-2019,2019,Other,New York,New York,United States,North America,2015,"61,00,00,000",Undisclosed,,,,
TravelPerk,"1,00,00,00,000",12/1/2022,2022,Travel,Barcelona,Catalonia,Spain,Europe,2015,"40,80,00,000",LocalGlobe, Kinnevik, Felix Capital,,
YugaByte,"1,00,00,00,000",28-10-2021,2021,Data management & analytics,Sunnyvale,California,United States,North America,2016,"29,10,00,000",Lightspeed Venture Partners, Dell Technologies Capital, Wipro Ventures,,
Intercom,"1,00,00,00,000",27-03-2018,2018,Internet software & services,San Francisco,California,United States,North America,2011,"24,10,00,000",FirstMark Capital, Tiger Global Management,,,
OVO Energy,"1,00,00,00,000",14-02-2019,2019,Other,Bristol,England,United Kingdom,Europe,2009,"32,40,00,000",Mitsubishi Corporation, Mayfair Equity Partners,,,
BigID,"1,00,00,00,000",16-12-2020,2020,Cybersecurity,New York,New York,United States,North America,2015,"24,60,00,000",BOLDstart Ventures, SAP.iO Fund, Scale Venture Partners,,
CaptivateIQ,"1,00,00,00,000",26-01-2022,2022,Fintech,San Francisco,California,United States,North America,2014,"16,50,00,000",Sequoia Capital, Y Combinator, Accel,,
Flipdish,"1,00,00,00,000",13-01-2022,2022,Internet software & services,Dublin,California,Ireland,Europe,2015,"15,70,00,000",Tencent Holdings, Tiger Global Management, Global Founders Capital,,
Honor Technology,"1,00,00,00,000",5/10/2021,2021,Internet software & services,San Francisco,California,United States,North America,2014,"32,50,00,000",Andreessen Horowitz, Prosus Ventures, Thrive Capital,,
Incode Technologies,"1,00,00,00,000",7/12/2021,2021,Cybersecurity,San Francisco,California,United States,North America,2015,"25,70,00,000",Dila Capital, Framework Ventures, 3L,,
Kuaikan Manhua,"1,00,00,00,000",1/12/2017,2017,Internet software & services,Beijing,Beijing,China,Asia,2014,"59,40,00,000",Sequoia Capital China, CMC Capital Partners, Tencent Holdings,,
Marshmallow,"1,00,00,00,000",8/9/2021,2021,Fintech,London,England,United Kingdom,Europe,2017,"11,60,00,000",Passion Capital, Hedosophia, Outrun Ventures,,
Mythical Games,"1,00,00,00,000",4/11/2021,2021,Internet software & services,Sherman Oaks,California,United States,North America,2018,"26,00,00,000",Javelin Venture Partners, Struck Capital, Alumni Ventures Group,,
Route,"1,00,00,00,000",21-01-2022,2022,"Supply chain, logistics, & delivery",Lehi,Utah,United States,North America,2018,"48,20,00,000",Madrona Venture Group, Banner Ventures, FJ Labs,,
Tackle.io,"1,00,00,00,000",21-12-2021,2021,Internet software & services,Boise,Idaho,United States,North America,2016,"14,80,00,000",Andreessen Horowitz, Bessemer Venture Partners, Coatue Management,,
Nexii,"1,00,00,00,000",8/9/2021,2021,Other,Vancouver,British Columbia,Canada,North America,2020,"4,50,00,000",Trane Technologies, Honeywell,,,
GalaxySpace,"1,00,00,00,000",17-11-2020,2020,Mobile & telecommunications,Beijing,Beijing,China,Asia,2016,"1,40,00,000",Shunwei Capital Partners, 5Y Capital, Legend Capital,,
Insider,"1,00,00,00,000",28-02-2022,2022,Internet software & services,Istanbul,Istanbul,Turkey,Europe,2012,"16,70,00,000",Wamda Capital, Endeavor, Riverwood Capital,,
Spiber,"1,00,00,00,000",8/9/2021,2021,Other,Tsuruoka,Yamagata Prefecture,Japan,Asia,2007,"52,00,00,000",Cool Japan Fund, JAFCO, The Carlyle Group,,
Ada Support,"1,00,00,00,000",7/5/2021,2021,Artificial intelligence,Toronto,Ontario,Canada,North America,2016,"19,10,00,000",Version One Ventures, Bessemer Venture Partners, FirstMark Capital,,
AgentSync,"1,00,00,00,000",7/12/2021,2021,Fintech,Denver,Colorado,United States,North America,2018,"11,10,00,000",Craft Ventures, Caffeinated Capital, Operator Collective,,
Alation,"1,00,00,00,000",3/6/2021,2021,Internet software & services,Redwood City,California,United States,North America,2012,"19,20,00,000",Costanoa Ventures, Data Collective, Salesforce Ventures,,
Avant,"2,00,00,00,000",17-12-2012,2012,Artificial intelligence,Chicago,Illinois,United States,North America,2012,"65,80,00,000",RRE Ventures, Tiger Global, August Capital,,
CarDekho,"1,00,00,00,000",13-10-2021,2021,E-commerce & direct-to-consumer,Jaipur,Rajasthan,India,Asia,2008,"44,80,00,000",Sequoia Capital India, Hillhouse Capital Management, Sunley House Capital Management,,
Copado,"1,00,00,00,000",13-09-2021,2021,Data management & analytics,Chicago,Illinois,United States,North America,2013,"27,10,00,000",Insight Partners, Salesforce Ventures, Perpetual Investors,,
DailyPay,"1,00,00,00,000",18-05-2021,2021,Fintech,New York,New York,United States,North America,2016,"18,90,00,000",RPM Ventures, Inspiration Ventures, Carrick Capital Partners,,
FloQast,"1,00,00,00,000",21-07-2021,2021,Fintech,Los Angeles,California,United States,North America,2013,"23,00,00,000",Polaris Partners, Insight Partners, Norwest Venture Partners,,
Gem,"1,00,00,00,000",28-09-2021,2021,Internet software & services,San Francisco,California,United States,North America,2017,"14,80,00,000",Accel, Greylock Partners, Meritech Capital Partners,,
GrubMarket,"1,00,00,00,000",14-09-2021,2021,E-commerce & direct-to-consumer,San Francisco,California,United States,North America,2013,"38,20,00,000",GGV Capital, BlackRock, ACE & Company,,
Helium Systems,"1,00,00,00,000",22-02-2022,2022,Internet software & services,San Francisco,California,United States,North America,2013,"36,50,00,000",FirstMark Capital, Tiger Global Management, FTX Venture,,
Inari,"1,00,00,00,000",12/5/2021,2021,Other,Cambridge,Massachusetts,United States,North America,2016,"33,70,00,000",Flagship Pioneering, Alexandria Venture Investments, Investment Corporation of Dubai,,
Jokr,"1,00,00,00,000",2/12/2021,2021,E-commerce & direct-to-consumer,New York,New York,United States,North America,2021,"43,00,00,000",GGV Capital, Tiger Global Management, Greycroft,,
LivSpace,"1,00,00,00,000",8/2/2022,2022,E-commerce & direct-to-consumer,Bengaluru,Karnataka,India,Asia,2015,"42,70,00,000",Jungle Ventures, Helion Venture Partners, INGKA Investments,,
Merama,"1,00,00,00,000",9/12/2021,2021,E-commerce & direct-to-consumer,Mexico City,Mexico City,Mexico,North America,2020,"34,50,00,000",SoftBank Latin America Fund, Advent International, Balderton Capital,,
MindTickle,"1,00,00,00,000",3/8/2021,2021,Internet software & services,San Francisco,California,United States,North America,2012,"28,10,00,000",Qualcomm Ventures, Accel, Canaan Partners,,
MyGlamm,"1,00,00,00,000",10/11/2021,2021,E-commerce & direct-to-consumer,Mumbai,Maharashtra,India,Asia,2015,"31,00,00,000",L'Occitane, Trifecta Capital, Bessemer Venture Partners,,
Oda,"1,00,00,00,000",2/6/2021,2021,E-commerce & direct-to-consumer,Oslo,Oslo,Norway,Europe,2013,"33,70,00,000",Kinnevik, Softbank Group, Prosus Ventures,,
Offchain Labs,"1,00,00,00,000",31-08-2021,2021,Internet software & services,Princeton,New Jersey,United States,North America,2018,"12,40,00,000",Pantera Capital, Polychain Capital, Lightspeed Venture Partners,,
Phantom,"1,00,00,00,000",31-01-2022,2022,Fintech,San Francisco,California,United States,North America,2021,"11,80,00,000",Paradigm, Andreessen Horowitz, Jump Capital,,
Pilot.com,"1,00,00,00,000",26-03-2021,2021,Fintech,San Francisco,California,United States,North America,2016,"16,10,00,000",Index Ventures, Sequoia Capital, Bezos Expeditions,,
Prime Medicine,"1,00,00,00,000",13-07-2021,2021,Health,Cambridge,Massachusetts,United States,North America,2019,"31,50,00,000",Newpath Partners, Google Ventures, F-Prime Capital,,
Public,"1,00,00,00,000",17-02-2021,2021,Fintech,New York,New York,United States,North America,2008,"30,90,00,000",Accel, Greycroft, Advancit Capital,,
Qumulo,"1,00,00,00,000",16-07-2020,2020,Data management & analytics,Seattle,Washington,United States,North America,2012,"34,70,00,000",Madrona Venture Group, Kleiner Perkins Caufield & Byers, Highland Capital Partners,,
Rohlik,"1,00,00,00,000",1/7/2021,2021,"Supply chain, logistics, & delivery",Prague,Prague,Czech Republic,Europe,2019,"38,00,00,000",Partech Partners, Index Ventures, Quadrille Capital,,
SeekOut,"1,00,00,00,000",12/1/2022,2022,Internet software & services,Bellevue,Washington,United States,North America,2017,"18,90,00,000",Mayfield, Madrona Venture Group, Tiger Global Management,,
SmartMore,"1,00,00,00,000",24-06-2021,2021,Artificial Intelligence,Shenzhen,Guangdong,China,Asia,2019,"30,00,00,000",IDG Capital, ZhenFund, Sequoia Capital China,,
Tealium,"1,00,00,00,000",3/2/2021,2021,Internet software & services,San Diego,California,United States,North America,2008,"26,40,00,000",Georgian Partners, Silver Lake, Presidio Ventures,,
UpGrad,"1,00,00,00,000",9/8/2021,2021,Edtech,Mumbai,Maharashtra,India,Asia,2015,"19,40,00,000",Qualcomm Ventures, Accel, Canaan Partners,,
Workhuman,"1,00,00,00,000",23-06-2020,2020,Internet software & services,Dublin,California,Ireland,Europe,1999,"90,00,000",ICG,,,,
Xpressbees,"1,00,00,00,000",9/2/2022,2022,"Supply chain, logistics, & delivery",Pune,Maharashtra,India,Asia,2012,"57,30,00,000",Norwest Venture Partners, Investcorp, Blackstone,,
L&P Cosmetic,"1,00,00,00,000",1/1/2016,2016,Consumer & retail,Seoul,Seoul,South Korea,Asia,2009,"3,30,00,000",CDIB Capital,,,,
Mininglamp Technology,"1,00,00,00,000",27-03-2019,2019,Artificial intelligence,Beijing,Beijing,China,Asia,2014,"78,70,00,000",Russia-China Investment Fund, Tencent Holdings, Sequoia Capital China,,
Luoji Siwei,"1,00,00,00,000",20-07-2017,2017,Edtech,Beijing,Beijing,China,Asia,2012,"14,40,00,000",Sequoia Capital China, Qiming Venture Partners, Tencent Holdings,,
IRL,"1,00,00,00,000",15-06-2021,2021,Internet software & services,San Francisco,California,United States,North America,2017,"19,70,00,000",Goodwater Capital, Floodgate, Founders Fund,,
Modern Health,"1,00,00,00,000",11/2/2021,2021,Health,San Francisco,California,United States,North America,2017,"16,70,00,000",Kleiner Perkins Caufield & Byers, Afore Capital, Founders Fund,,
Tuhu,"1,00,00,00,000",15-09-2018,2018,Auto & transportation,Shanghai,Shanghai,China,Asia,2011,"87,50,00,000",Qiming Venture Partners, Yaxia Automobile, Far East Horizon,,
CloudBees,"1,00,00,00,000",9/12/2021,2021,Data management & analytics,San Jose,California,United States,North America,2010,"23,60,00,000",Matrix Partners, Lightspeed Venture Partners, Verizon Ventures,,
Elemy,"1,00,00,00,000",6/10/2021,2021,Health,San Francisco,California,United States,North America,2019,"32,30,00,000",General Catalyst, Bling Capital, Felicis Ventures,,
Guideline,"1,00,00,00,000",16-06-2021,2021,Fintech,San Mateo,California,United States,North America,2015,"33,90,00,000",Pelion Venture Partners, Foundation Capital, Thoma Bravo,,
Happy Money,"1,00,00,00,000",8/2/2022,2022,Fintech,Tustin,California,United States,North America,2009,"19,20,00,000",FirstMark Capital, Anthemis, CMFG Ventures,,
Hive,"2,00,00,00,000",21-04-2021,2021,Artificial intelligence,San Francisco,California,United States,North America,2013,"12,10,00,000",Tomales Bay Capital, Bain & Company, General Catalyst,,
STORD,"1,00,00,00,000",13-09-2021,2021,"Supply chain, logistics, & delivery",Atlanta,Georgia,United States,North America,2015,"20,50,00,000",Dynamo VC, Susa Ventures, Founders Fund,,
At-Bay,"1,00,00,00,000",27-07-2021,2021,Fintech,Mountain View,California,United States,North America,2016,"29,20,00,000",Lightspeed Venture Partners, Khosla Ventures, Munich Re Ventures,,
TELD,"1,00,00,00,000",16-12-2019,2019,Fintech,Qingdao,Shandong,China,Asia,2014,"39,60,00,000",China Reform Fund, Gaopeng Capital, Jinhui Xingye,,
Acko General Insurance,"1,00,00,00,000",28-10-2021,2021,Fintech,Bengaluru,Karnataka,India,Asia,2016,"45,80,00,000",Intact Ventures, Munich Re Ventures, General Atlantic,,
apna,"1,00,00,00,000",15-09-2021,2021,Internet software & services,Bengaluru,Karnataka,India,Asia,2019,"19,30,00,000",Sequoia Capital India, Rocketship.vc, Lightspeed India Partners,,
Beyond Identity,"1,00,00,00,000",22-02-2022,2022,Cybersecurity,New York,New York,United States,North America,2019,"20,50,00,000",New Enterprise Associates, Koch Disruptive Technologies, Evolution Equity Partners,,
Carousell,"1,00,00,00,000",15-09-2021,2021,E-commerce & direct-to-consumer,,,Singapore,Asia,2012,"28,80,00,000",500 Global, Rakuten Ventures, Golden Gate Ventures,,
Chief,"1,00,00,00,000",31-03-2022,2022,Other,New York,New York,United States,North America,2019,"14,00,00,000",General Catalyst, Inspired Capital, Flybridge Capital Partners,,
CoinDCX,"1,00,00,00,000",10/8/2021,2021,Fintech,Maharashtra,Maharashtra,India,Asia,2017,"10,90,00,000",Polychain Capital, Coinbase Ventures, Jump Capital,,
Daily Harvest,"1,00,00,00,000",16-11-2021,2021,E-commerce & direct-to-consumer,New York,New York,United States,North America,2014,"12,00,00,000",M13, Lightspeed Venture Partners, Lone Pine Capital,,
Enpal,"1,00,00,00,000",18-10-2021,2021,Internet software & services,Berlin,Berlin,Germany,Europe,2017,"30,40,00,000",HV Capital, Softbank Group, BlackRock,,
eSentire,"1,00,00,00,000",22-02-2022,2022,Cybersecurity,Waterloo,California,Canada,North America,2001,"18,60,00,000",Edison Partners, Georgian Partners, VentureLink,,
Firefly Aerospace,"1,00,00,00,000",4/5/2021,2021,Other,Cedar Park,Texas,United States,North America,2014,"17,20,00,000",XBTO Ventures, Raven One Ventures, SK Ventures,,
Fundbox,"1,00,00,00,000",30-11-2021,2021,Fintech,San Francisco,California,United States,North America,2013,"40,40,00,000",Khosla Ventures, General Catalyst, Blumberg Capital,,
G2,"1,00,00,00,000",22-06-2021,2021,Internet software & services,New Chicago,California,United States,North America,2012,"25,80,00,000",Pritzker Group Venture Capital, Accel, Hyde Park Venture Partners,,
Gaussian Robotics,"1,00,00,00,000",10/11/2021,2021,Hardware,Shanghai,Shanghai,China,Asia,2013,"32,50,00,000",BlueRun Ventures, Grand Flight Investment, Meituan Dianping,,
GetYourGuide,"1,00,00,00,000",16-05-2019,2019,Travel,Berlin,Berlin,Germany,Europe,2009,"65,60,00,000",Spark Capital, Highland Europe, Sunstone Capital,,
GlobalBees,"1,00,00,00,000",28-12-2021,2021,E-commerce & direct-to-consumer,New Delhi,Delhi,India,Asia,2021,"18,50,00,000",Chiratae Ventures, SoftBank Group, Trifecta Capital,,
Ivalua,"1,00,00,00,000",21-05-2019,2019,Fintech,Redwood City,California,United States,North America,2000,"13,40,00,000",Ardian, Tiger Global Management, KKR,,
Juanpi,"1,00,00,00,000",14-04-2016,2016,E-commerce & direct-to-consumer,Wuhan,Hubei,China,Asia,2012,"13,60,00,000",Tiantu Capital, SAIF Partners China, Newsion Venture Capital,,
Karat,"1,00,00,00,000",13-10-2021,2021,Internet software & services,Seattle,Washington,United States,North America,2014,"16,90,00,000",8VC, Norwest Venture Partners, Tiger Global Management,,
LEAD School,"1,00,00,00,000",13-01-2022,2022,Edtech,Andheri,Maharashtra,India,Asia,2012,"16,60,00,000",WestBridge Capital, GSV Ventures, Elevar Equity,,
Nexthink,"1,00,00,00,000",8/2/2021,2021,Data management & analytics,Prilly,Vaud,Switzerland,Europe,2004,"34,60,00,000",Auriga, Galeo Ventures, Highland Europe,,
People.ai,"1,00,00,00,000",11/8/2021,2021,Internet software & services,San Francisco,California,United States,North America,2017,"20,00,00,000",GGV Capital, Lightspeed Venture Partners, ICONIQ Capital,,
Pharmapacks,"1,00,00,00,000",12/11/2020,2020,E-commerce & direct-to-consumer,Islandia,Florida,United States,North America,2010,"43,30,00,000",The Carlyle Group,,,,
Rightway,"1,00,00,00,000",30-03-2021,2021,Health,New York,New York,United States,North America,2017,"13,00,00,000",Thrive Capital, Khosla Ventures, Tiger Global Management,,
Sennder,"1,00,00,00,000",14-01-2021,2021,"Supply chain, logistics, & delivery",Berlin,Berlin,Germany,Europe,2015,"34,00,00,000",Accelm Scania Growth Capital, Lakestar,,,
Sisense,"1,00,00,00,000",9/1/2020,2020,Data management & analytics,New York,New York,United States,North America,2004,"27,40,00,000",Opus Capital, Genesis Partners, Battery Ventures,,
Staffbase,"1,00,00,00,000",15-03-2022,2022,Internet software & services,Chemnitz,Saxony,Germany,Europe,2014,"30,70,00,000",Insight Partners, e.ventures, General Atlantic,,
Sunbit,"1,00,00,00,000",20-05-2021,2021,Fintech,Los Angeles,California,United States,North America,2016,"21,00,00,000",Zeev Ventures, Group11, Chicago Ventures,,
TangoMe,"1,00,00,00,000",20-03-2014,2014,Mobile & telecommunications,Mountain View,California,United States,North America,2009,"36,10,00,000",Draper Fisher Jurtson, Qualcomm Ventures, Alibaba Group,,
The Bank of London,"1,00,00,00,000",30-11-2021,2021,Fintech,London,England,United Kingdom,Europe,2018,"9,00,00,000",Mangrove Capital Partners,14W, ForgeLight,,
Zego,"1,00,00,00,000",9/3/2021,2021,Fintech,London,England,United Kingdom,Europe,2016,"20,20,00,000",LocalGlobe, Balderton Capital, Target Global,,
Nxin,"1,00,00,00,000",18-09-2018,2018,Internet software & services,Beijing,Beijing,China,Asia,2015,"5,30,00,000",Beijing Juneng Hesheng Industry Investment Fund, Beijing Shuju Xinrong Fund,,,
Mamaearth,"1,00,00,00,000",28-12-2021,2021,E-commerce & direct-to-consumer,Gurugram,Haryana,India,Asia,2016,"11,10,00,000",Fireside Ventures, Sequoia Capital India, Stellaris Venture Partners,,
Radius Payment Solutions,"1,00,00,00,000",27-11-2017,2017,Fintech,Crewe,England,United Kingdom,Europe,1990,"20,00,00,000",Inflexion Private Equity,,,,
Rivigo,"1,00,00,00,000",11/7/2019,2019,"Supply chain, logistics, & delivery",Gurugram,Haryana,India,Asia,2014,"24,70,00,000",SAIF Partners India, Warburg Pincus, Trifecta Capital Advisors,,
Rubicon,"1,00,00,00,000",25-08-2017,2017,Other,Atlanta,Georgia,United States,North America,2008,"22,30,00,000",Goldman Sachs, Leonardo DiCaprio, Promecap,,
Socar,"1,00,00,00,000",16-10-2020,2020,Auto & transportation,Jeju Province,Jeju Province,South Korea,Asia,2012,"40,80,00,000",Bain Capital, Altos Ventures, Songhyun Investment,,
MobileCoin,"1,00,00,00,000",7/7/2021,2021,Fintech,San Francisco,California,United States,North America,2018,"10,70,00,000",General Catalyst, Future Ventures, AU21,,
Density,"1,00,00,00,000",10/11/2021,2021,Hardware,San Francisco,California,United States,North America,2014,"21,70,00,000",Founders Fund, Upfront Ventures, 01 Advisors,,
Instabase,"1,00,00,00,000",21-10-2019,2019,Data management & analytics,San Francisco,California,United States,North America,2015,"13,20,00,000",New Enterprise Associates, Greylock Partners, Andreessen Horowitz,,
Jiuxian,"1,00,00,00,000",30-07-2015,2015,E-commerce & direct-to-consumer,Beijing,Beijing,China,Asia,2009,"25,00,00,000",Sequoia Capital China, Rich Land Capital, Merrysunny Wealth,,
Matrixport,"1,00,00,00,000",1/6/2021,2021,Fintech,,,Singapore,Asia,2019,"10,00,00,000",Dragonfly Captial, Qiming Venture Partners, DST Global,,
Mixpanel,"1,00,00,00,000",15-11-2021,2021,Internet software & services,San Francisco,California,United States,North America,2009,"27,70,00,000",Bain Capital Tech Opportunities, Andreessen Horowitz, Sequoia Capital,,
Sendbird,"1,00,00,00,000",6/4/2021,2021,Mobile & telecommunications,San Mateo,California,United States,North America,2013,"22,10,00,000",FundersClub, Y Combinator, Tiger Global Management,,
OrCam Technologies,"1,00,00,00,000",20-02-2018,2018,Artificial intelligence,Jerusalem,Jerusalem District,Israel,Asia,2010,"8,60,00,000",Intel Capital, Aviv Venture Capital,,,
Leap Motor,"1,00,00,00,000",20-11-2018,2018,Auto & transportation,Hangzhou,Zhejiang,China,Asia,2015,"1,00,00,00,000",Sequoia Capital China, Gopher Asset Management, Shanghai Electric Group,,
1KMXC,"1,00,00,00,000",30-08-2021,2021,Hardware,Hangzhou,Zhejiang,China,Asia,2014,"8,60,00,000",Goldman Sachs Asset Management, SDP Investment, Alibaba Group,,
58 Daojia,"1,00,00,00,000",12/10/2015,2015,Internet software & services,Beijing,Beijing,China,Asia,2014,"30,00,00,000",KKR, Alibaba Group, Ping An Insurance,,
Agile Robots,"1,00,00,00,000",9/9/2021,2021,Hardware,Munich,Munich,Germany,Europe,2018,"24,00,00,000",Hillhouse Capital Management, Sequoia Capital China, Linear Venture,,
Aibee,"1,00,00,00,000",13-04-2021,2021,Artificial intelligence,Beijing,Beijing,China,Asia,2017,"27,30,00,000",Sequoia Capital China, Lenovo Capital and Incubator, Group GSR Ventures,,
Aircall,"1,00,00,00,000",23-06-2021,2021,Internet software & services,New York,New York,United States,North America,2014,"22,60,00,000",Balderton Capital, Next World Capital, Draper Esprit,,
Ajaib,"1,00,00,00,000",4/10/2021,2021,Fintech,Jakarta,Jakarta,Indonesia,Asia,2018,"24,50,00,000",Softbank Ventures Asia, Alpha JWC Ventures, Insignia Ventures Partners,,
Alto Pharmacy,"1,00,00,00,000",30-01-2020,2020,Health,San Francisco,California,United States,North America,2015,"52,40,00,000",Jackson Square Ventures, Greenoaks Capital Management, Softbank Group,,
Amagi,"1,00,00,00,000",16-03-2022,2022,Internet software & services,Bengaluru,Karnataka,India,Asia,2008,"24,00,00,000",Mayfield, Accel, Norwest Venture Partners,,
Amount,"1,00,00,00,000",17-05-2021,2021,Fintech,Chicago,Illinois,United States,North America,2019,"24,30,00,000",Invus Group, Hanaco Venture Capital, WestCap Group,,
VerbIT,"2,00,00,00,000",8/6/2021,2021,Artificial intelligence,New York,New York,United States,North America,2016,"43,20,00,000",ClalTech, Vertex Ventures, Oryzn Capital,,
OpenAI,"3,00,00,00,000",22-07-2019,2019,Artificial intelligence,San Francisco,California,United States,North America,2015,"1,00,00,00,000",Khosla Ventures,,,,
Aptos,"1,00,00,00,000",15-03-2022,2022,Internet software & services,Palo Alto,California,United States,North America,2021,"20,00,00,000",Andreessen Horowitz, Coinbase Ventures, Tiger Global Management,,
Aqua Security,"1,00,00,00,000",10/3/2021,2021,Cybersecurity,Ramat Gan,Tel Aviv District,Israel,Asia,2015,"26,50,00,000",TLV Partners, Lightspeed Venture Partners, M12,,
Assembly,"1,00,00,00,000",21-09-2021,2021,Internet software & services,Culver City,California,United States,North America,2019,0,Advent International, PSG, Providence Equity Partners,,
Assent,"1,00,00,00,000",6/1/2022,2022,"Supply chain, logistics, & delivery",Ottawa,Ontario,Canada,North America,2010,"53,40,00,000",Vista Equity Partners, Warburg Pincus, First Ascent Ventures,,
Uniphore,"3,00,00,00,000",16-02-2022,2022,Artificial Intelligence,Palo Alto,California,United States,North America,2008,"60,70,00,000",Chiratae Ventures, March Capital Partners, National Grid Partners,,
Axelar,"1,00,00,00,000",15-02-2022,2022,Internet software & services,Waterloo,Ontario,Canada,North America,2020,"6,40,00,000",Lemniscap VC, North Island Ventures, Polychain Capital,,
Axiom Space,"1,00,00,00,000",16-02-2021,2021,Other,Houston,Texas,United States,North America,2016,"15,00,00,000",C5 Capital, Hemisphere Ventures, The Venture Collective,,
Banma Network Technologies,"1,00,00,00,000",13-09-2018,2018,Auto & transportation,Shanghai,Shanghai,China,Asia,2015,"69,70,00,000",Yunfeng Capital, SDIC Innovation Investment Management, Shang Qi Capital,,
BeiBei,"1,00,00,00,000",22-01-2015,2015,E-commerce & direct-to-consumer,Hangzhou,Zhejiang,China,Asia,2011,"22,40,00,000",Banyan Capital, New Horizon Capital, IDG Capital Partners,,
BenevolentAI,"1,00,00,00,000",2/6/2015,2015,Artificial intelligence,London,England,United Kingdom,Europe,2013,"29,20,00,000",Woodford Investment Management,,,,
Berlin Brands Group,"1,00,00,00,000",1/9/2021,2021,E-commerce & direct-to-consumer,Berlin,Berlin,Germany,Europe,2005,"80,00,00,000",Ardian, Bain Capital,,,
